session_id,query
131559,how many women are on this planet
191481,vine
191481,what's the definition of archive
191481,yeah that's fine google
287055,what's 15 - 7
287055,how many days until april 29th 2019 2029
185878,how do you spell imagining
169952,what's 24 - 8
230393,brass
185897,where is teen titans go streaming
81020,when we go to mcdonald's
93711,you're awesome
15196,2:00 PM
26090,how many hairs does the average human eat in a day without doing it
75575,when is easter
49038,how do you spell despicable
269791,where is rick and morty streaming
273438,what's 70 * 4
54183,much time is left
227804,what does ceo stand for
5972,how many ounces in a pound
122950,what's 23 - 9
242287,what's the code to the secret lab in stray
248622,where is the yellow plant in stray
53723,how do you get to the vip room in straight
53723,how do you get to the vip room in stray
53723,how do you get into the vip room in the nightclub
53723,how do you get in the vip room in in the
29663,what's 20 * 20
32197,what is minions on
32197,where is minions streaming
195458,how many inches is 39.4 cm
184722,what's 7 * 14
269985,how do you spell spectator
97158,what colors can cats see
37215,6:30
187337,is it below freezing
73840,6:30
21792,what's 10 * call
21792,how do you spell incremental
197482,how do you spell separation
27095,because
63834,what temperature is chicken supposed to be at
234658,what's 35 - 13
191035,how many days until christmas
99745,how many inches is 22 ml
46694,have they invented a time machine
46694,when is son's day
46694,what holiday is on saturday march 4th 2023
46694,is there a day for sons
226826,oppa gangnam style
230918,what's a good ping
21931,what color are toadstools
240731,who wrote sherlock holmes
84924,what is 8 + 8
208473,who plays clara in doctor who
31054,1:30
58758,how far up in the air do you planes fly
58758,45000 ft hey google what's 35000 / 6 make a ginormous milk set on table come on sit down
58758,what's 35000 / 6
234056,how long are cinnamon twists good in the fridge
69109,define universality
69109,define catharsis
219810,who is mary c townsend
54345,what's a billion times a million
231956,who voices smoky quartz
93777,how much time how much time is left
118319,what time do the ghost come and grill a tag
118319,are there ghosts in gorilla tag minecraft
265573,metastasis
63878,why are you not working
63878,who's your best friend
73910,what day is it tomorrow
16141,how old is samuel l jackson
84756,mark rober
84756,school olympic
84756,scroll olympics
84756,squirrel olympics
13919,school olympic
13919,school olympics
13919,squirrel olympics 4.0
195857,how do you spell dance
195857,how do you spell should
159341,where does kreekcraft live
46329,mind
46329,futurama
116044,only lovers left alive
33994,po15 tutorial
26655,what's the average 3d printer nozzle size
26655,what temperature do i put the nozzle at to change it
26655,what temperature should i put the 3d printing nozzle in order to switch it out
26655,how do i change a 3d printer nozzle
197729,how old was jason voorhees when he drowned
197729,what's the name of the lady that dies on twin peaks
208692,what's the current phase of the moon
208692,what's the current moon phase
208692,current moon phase
98775,what is spooky's house of jump scares come out
132133,color theory
132133,how to do color color
132133,color theory for beginners
132133,advanced color theory
132133,color theory advanced
201331,or hey siri
137781,in my area
144952,what temperature is pork supposed to be cooked at
227838,madagascar
127673,what date is mother's day in 2021
22765,can you take tylenol after having a covid shot
288115,how long do you leave a quesadilla in a quesadilla maker
28407,can you take benadryl before getting your modernica vaccine
287603,how do you spell pantomime
244093,what does bbc stand for
99001,does purdue have a home game tomorrow
99001,is purdue university having a football game tomorrow
132406,what does rfq stand for
132406,what does force majeure stand for
27616,is sweet almond oil a carrier oil for essential oils
16218,what is the song o come all ye faithful about
16218,answer me
16218,what is the most popular christmas song in the world
266559,what's 8 * 4
68016,how many days is it until february 27th
258634,what is 21 + 16 + 18
258634,what is 12 weeks from thanksgiving of 2021
170470,why are you now
72774,what is the absolute value of 2 - 5
210578,so why is it when you google
195486,how do you spell awesome awesome witch
195486,how do you spell aussie witch
60038,what is the date for next monday
60038,how many days are there in august
273274,how many days has it been since june 1st
170829,how many days is it from april 1st to december 25th
265790,what's going on in the world today
265790,what's going on in the usa today
287288,what is ivory made of
230150,how do you make tartar sauce
230150,ingredients
74618,please tell me a story
74618,frozen apple
74618,slime
74618,peach
74618,FALSE
74618,it's obvious
74618,french fries
74618,tom wolfe
74618,how long does it take nortriptyline to get out of your system
74618,what's going on in the united states today
209420,what is the best kind of magnesium for pooping
209420,how much of magnesium citrate can you take a day
209420,does a vitamin d supplement make you constipated or does it help you poop
161404,does hyoscyamine make you pee
131704,how far is 5 cm
131704,how many days ago was april 1st
36227,does tennessee have mountains
132754,how many days is it until february 27th
31665,how do you spell souvenir
35901,what is 8 * 3
35901,what is 6 * 24
213090,what is 15% off of 50 dollars
287238,how humid is it outside
130140,like a song
232280,is next year a leap year
268008,when is the purdue football game
90534,what are the names of the powerpuff girls
90534,what is the red button
90534,what is the red powerpuff girl called
197933,are you connected to wi-fi
74645,will i need a coat
74645,what time are the showers today
250356,how much is 49003 lankan rupees in australian dollars
25107,read me news from australia
132390,make bread
150481,what is 1000 australian dollars in british pounds
23697,what's 658 / 2
46298,what is schmaltz
235715,what's 17 x 2
235715,what is 0.17 x 20
188314,clinton's
188314,macdonald's
16731,what is 1500 /
16731,what is 1500 / 12
230652,what is the score in the sri lanka pakistan test match
230652,what's the score
107679,can you describe which country too much to me
195321,hold down the button and then say open youtube tv
233549,open ebay
233549,who's the prime minister of norway
239939,both
93897,what will be the high tonight
254813,9:30
171607,what is 5 * 207
171607,what's 12 x 12
171607,can you look up some porn
171607,why is there water in my washer
171607,how long should you wait to water a cactus
261478,does putting a shirts in the bathroom light take a shower remove wrinkles
261478,if i leave clothes in the bathroom can it remove wrinkles
68362,what kind of potatoes should i buy for a baked potato
68362,what are the main types of potatoes
68362,know if you get the number two
249711,what's the difference between lemonade and lemon juice
89932,what is the best lettuce for a sandwich
89932,how can i make my turkey sandwich better
89932,ingredients
89932,next ingredient
89932,does stirring a coffee make it cool down faster
230446,you unpair from my phone
188398,who's playing football this thursday
95966,how do i know when a banana is too bad
69375,how many tablespoons are in a third of a cup
30352,trolling
147574,when did avengers endgame come out
69629,what football games are tonight
69629,what's the score for the chiefs game today
69629,what games are playing tonight for football
31351,what's 121 + 105
71812,what's the name of the actor that plays edward in twilight
199057,how old is joel mchale
199057,how old is jamie renner
270701,the night manager
270701,night manager
14573,when does my local greggs close today
78723,3.30 / 1400
78723,2 / 1400
78723,times that by 100
270835,223 / 70
270835,3.19 x 500
94033,97 / 3
94033,12 / 3
94033,how many tablespoons no no stop
94033,how many millilitres is 2 tablespoons
94033,divide that by 3
226008,2 / 3
93250,the 15-minute one
193357,250 / 3
193357,250 - 83
232177,what can i use instead of thyme
187882,1 in in centimetres
72285,what is the song
72285,what song am i listening to
289361,70 x 2
61821,do i need to keep henderson's relish in the fridge
21563,what is the largest living organism on earth
94240,750 / 3
46723,423 / 3
46723,267 / 3
202513,47 / 100
202513,times that by 78
202513,42 x 78
202513,4.3 x 78
26299,15 x 12
193304,where should i store rhubarb
48182,big turn off the hey google
249293,i said fun
249293,i said sa n
134045,ok queen group
131621,15 x 8
16188,thanks bro
231448,all good thanks
88655,what's 125 billion dollars in australia in pounds
88655,125 billion australian dollars in pounds
240315,19 popcorn bucket
240315,mickey popcorn bucket
75122,what are the house odds on blackjack
372,charizard ex 151
152379,how many episodes are there of only murders in the building
121264,how old was princess diana when she died
217238,don't bother
217238,who's roger
196781,who invented morse code
196781,what year was morse code invented
196781,what did james watt invent
196781,what's the difference between ac and dc
189449,how old is scott mctominay
189449,how long has olly gunnar solskjaer been man united manager
189449,what date was that
149778,joe's kitchen
230641,who won the fa cup this year
230641,"what is $14,000 worth in sterling"
142020,can you ring for the next 55 days
142020,for both the same richard
142020,richard
165859,do you take tomato plants out of greenhouses in the summer
234672,how much is see you later
234672,that's better
29881,what is bigger
29881,what is bigger alligators or crocodiles
132529,what is the word car in french
132529,the word english word because is the word cat in french
1192,how old is rory mcilroy
1192,how old is jordan spieth
242692,what does volkswagen mean in english
69754,can i freeze egg whites
22562,where was jason statham born
23878,what's a misogynist
23878,what's the other one
53614,which year did the european union first introduced the euro currency
235441,what's a normal blood pressure reading
235441,128
62037,how old is lewis hamilton
62037,when is lewis hamilton's birthday
88253,what's 1% of 26000
240721,how old is tom hardy
240721,how old is sebastian stan
78380,who succeeded elizabeth ii of throne
214361,what does condensated mean
214361,no condensate
98346,stop transmitting in the kitchen
70865,i thought the protection physical protection of a car seat and if you have an accident that can result in no serious injuries that your pelvis is playing ok google
70865,is asparagus a spring plant
70865,what's the main ingredient of the dish
70865,what's the main ingredient of spanner copia
70865,confuse my niece
127145,when is international men's day
233030,what is the definition of a sociopath
209341,stop forget it
264503,what's the score of the flyers game today
199276,tell me what time it is
194319,how can i play audiobooks
194319,do i have any books on audio
207172,dead rising transmissionary trophy
184240,how much does the microsoft surface pro 7 weigh
184240,what is 1.7 lbs in kilograms
244198,leeds united next fixture
90015,forza horizon stuck installing on series x
90015,forza horizon stuck installing at 93%
4881,where is the barn find in the quarry in forza horizon 4
185790,win in peel p50 achievement
230420,can you put tea bags in a compost bin
252583,manchester united french defenders
87908,why do guinea pigs swear their back ends
87908,why do guinea pigs shake from side to side
56638,toyota map system waiting for restart
56638,why is android auto automatically disconnecting
234747,how much ram should a desktop pc have
242419,help super silly crow escape from the television
96955,titanfall 2 game 15 net worth
98844,putting a hat on trophy
17279,the legend of hell house
38149,what is 103 turkish lira
38149,what is 103 turkish lira in uk pounds
134063,how do you pay for things on the dark web
56957,side effects of constipation
234480,can you feed dogs tinned mangoes
16381,which type of coffees have hot chocolate added
225436,dukono volcano height
225436,pacaya volcano height
225436,mount st. helens height
225436,carry me ski volcano height
225436,karen miski volcano height
225436,karymsky volcano height
225436,the laughing in volcano height
225436,the loving in volcano height
225436,golovnin volcano height
225436,mount shasta volcano height
225436,mount merapi height
225436,kauea height
225436,kilauea height
225436,sakurajima height
225436,mauna kea height
225436,reventador height
225436,cotopaxi height
225436,krakatoa height
225436,mount tambora height
225436,mount erebus height
225436,villarrica height
225436,mount rainier height
225436,masaya volcano height
225436,samira height
225436,mount fuji height
225436,mount height
225436,semeru height
197677,can you use an xbox 360 controller with an xbox series x console
227377,la vuelta 2023
241007,a short hike get
241007,a short hike get the
241007,a short hike get the commemorative hat
25839,umbrella plant leaves dropping off
237596,when are england playing north macedonia
13778,when will it be march
113998,do you understand anything
269454,8:30
127155,what is lucid dreaming
127155,tell me different types of dreams
127155,what is an epic dream
127155,is the football on today
73476,what are the benefits of neem oil
187909,when will the wind stop
195905,what does pertinent mean
288774,is the football on saturday
288774,is boxing on right hey google is boxing on right now
288774,how many days until the 14th of june
28308,how do you shorten continued
239023,what's the human version of a cockroach
239023,what's the uk version of a cockroach
239023,what's the spiritual meaning of a termites
239023,what is a termites spirit animal meaning
239023,what is the spiritual term of a termite
3265,not really
228891,what does the temperature really feel like
160651,who is winning the football match right now
160651,what's the ghana football score right now
261629,how do i change the temperature
261629,8:30
265871,how many days until the 13th of february
107426,how many days until the 21st
264910,what are the health benefits of goji berry
17589,how long ago was it the 22nd of february
193385,can you let me know when it starts raining
86297,tell me the results
86297,is the moon full tonight
124346,can cats see color
219044,the back of my throat tickles when i breathe
219044,what is the back of my throat tickle when i breathe
219044,why do i feel like i'm going to cough when i breathe
262419,who was
30099,how tall is reese witherspoon
70115,how long is a rotisserie chicken good for
37091,what is tactical crawling called
156728,can cats have oil
156728,search chobani on the kroger app
72961,is 2 alcoholic drinks a day too much
149751,apples
149751,bananas
149507,can you stop
260009,what happens if a cat accidentally swallows a bone
291610,when's it supposed to start to rain tonight
68583,movie theater
195238,mini cooper r53 adjust seat back
49528,travel straw
188817,you will never see the shower
21288,show me tomorrow to update the bill for chinese gas and boxes
268658,how much do money orders cost
146023,is seltzer water healthy
113620,baratza encore grinder setup
173583,add multi-surface cleaner
145347,we don't talk about bruno
45103,royal buffet
58255,ben stiller kathryn hahn kristen wiig
150529,oops.
26239,what time of year do you see hummingbirds
56758,shortest and tallest nfl quarterbacks to win a super bowl
56758,average height for super bowl winning nfl quarterbacks
155217,how long should i wait between paint coats
54347,why does my car whistle on certain types of pavement
264714,do power strips drop power when plugged in and turned off
291819,can i wash a boar bristle brush
267528,diablo 4 hell tide map
267528,this is not
267528,diablo 4 interactive hell tide map
182424,do you take milk and sugar for coffee almond milk or like non dairy or regular milk
70276,how much does a pedicure cost
81354,define luncheon
230958,has covid spread
173617,lawyers sidney new york from two wheels
193920,apartments for rent
42238,does rocket mortgage offer mortgage insurance
227895,how's my day
27748,how do you get rid of hiccups
132421,who sells microwave stainless steel
132421,ok google who sells microwaves in sidney new york
280632,does walgreens install microwaves above the rain
280632,does walgreens install microwaves
280632,does vip waldron es install microwaves
280632,does home depot install and remove appliances
231191,does jo-ann's fabrics sell occupied replacement bulbs
231191,oculum
231191,accuweight replacement.com
231191,o t t l i t e cam
98297,recipe for skinless boneless chicken breast
92788,what age do you stop getting any other cramps
195366,what does it cost for a safety deposit box at a bank
234365,what was the final score of the carolina panthers game today
171812,no that's not the right one
209196,movie quiz
209196,yeah a little bit
209196,what quizzes do you have
209196,getting ripped off
209196,bargain
209196,dog
209196,cat
209196,king cobra
209196,naked mole rat
209196,answer one
73383,what is it your wish is my command
73383,what's the meaning of love
73383,ok google man united score tonight
73383,football score tonight
73383,what's the football score tonight
199760,ok google you getting it all wrong
199760,colorado sunrise 303
199760,hear me now by 3oh 3
199760,i'm so sad 303
74850,how many ounces in a cup?
22514,5 and 6 and 20
75475,off the xbox
39490,jane gummy bear
171925,how many seconds are in a million years
171925,how many seconds are in 100 years
130280,make a machine gun sound
262259,what's sean stop
73189,lifelight
185526,lunch me
36141,watch epix on xbox don't forget to remind me
189769,how old is machine gun kelly
251538,can you be can you answer alexa
251538,can you answer the name alexa
251538,okay alexa
173627,thunderstorm sounds
40387,what day is january 14th
231160,when's thanksgiving
231160,when is thanksgiving in canada
216879,is garlic bad for dogs
89164,what's the sound like that
89164,what's 3% of $9.28
89196,do i have any epsom salt
217624,is it okay to leave frozen meat out on the counter to defrost
77043,can i use butter instead of olive oil
77043,can i use butter in a cast iron pan
62089,can i defrost a steak in a microwave
150059,is there a champs sports in meriden
18166,how many motrins are you supposed to take in one dose
43432,the brodies
237266,what's an american size 40 mean
237266,what size sneaker is a 40 in american sizes
27526,who's talking all day long
54426,the facebook
231933,how much more snow are we supposed to get
227878,can you clean cast iron with soap and water
227878,can you clean a cast iron skillet with soap and water
95949,can dogs have mashed potatoes
242706,is there any rain this afternoon
71823,what was the date 14 days ago
123247,is polyester cooler than cotton
286992,how many days till the end of may
286992,how many days until may 31st
113887,and aloha
189777,what is a normal refrigerator setting
150865,how many ounces in 1 l
249988,what kind of special quarters came after the national parks
270018,is it bad for a dog to eat dead worms
238333,how many ounces is 3/4 of a cup
93460,music please
118112,when is halloween
197790,7.5 * 300
116168,if you hear a dog's nails on hardwood floors does that mean they need to be cut
246234,what's the difference between bright white and cool white in a light
39522,what should we watch
104638,who was the president in 2010
104638,who made the department of education
104638,was the department of education founded by jimmy carter after he was president
104638,when did the department of education start giving student loans
231872,what state are the broncos from
77621,jersey
204242,what's another word for tall
204242,what's another word for funny
204242,what's another word for palatable
204242,what's another word for snug
193260,release
97442,where is ghana
97442,what are the main exports of ghana
99453,what do i do with my puppy in the fear.
69991,how many ounces are in a cup?
44636,add study to to-do list
44636,add meal plan to to-do list
44636,add clean computer to to-do list
233407,how do you make a cheese frenchie
226182,take care of that now and i hope that we will talk to you in a little bit more
52671,is there still a book available with the character jimmy cuoco
52671,is there still a book available with the character jimmy coco
172690,how many cups are in a gallon
82861,how do you cook perogies
82861,how do i get back to the other recipes
224314,does the mailman deliver on columbus day
9320,what do you
68044,mummy is in bed go to sleep
233672,can you use lemon juice and bicarbonate soda to clean
233672,what do you not understand
181757,what about in london
78351,me and you flight of the conchords
231232,is 903 hours real
201217,school mario
53177,3.5 inch hard drive
53177,2.5 vs 3.5 hdd?
207067,everyday
207067,noon
3304,how tall was macho man randy savage
3304,earthworm jim new jack city
48065,what's the top speed of satta to
230743,find the natalie bags when he was in
259678,lyrics to naser show me what you got
259678,danger show me what you got there
25541,define thrusting
112617,nighthawk router
231552,schnauzer dog
75420,the nat
188238,how many times can you bend the samsung fold
87932,x900e bravia
14026,the rat by the walkmen
130014,bearded dragon
130014,rooster sriracha sauce
152545,what's the definition of amuse
152545,what's the definition of muse
48146,ok google call hippy
288901,sick ass boy
87656,ok google what song is this
251914,n64 earthworm jim
251914,earthworm jim 3d
251914,earthworm jim 2
251914,earthworm jim 2 review
47075,judge steve harvey
274023,show me sports news on espn.com
194523,george jefferson age when he first started in the jeffersons
194523,george jefferson net worth
194523,mad about you theme song best theme song ever
194523,no i'm not confident mad about you theme song
194523,incredible hulk theme song from 1972
218585,creed from nintendo
47002,is it legal to have sex with 13 year olds
64476,family guy the father
49199,when does henry wear shoes
49199,when is festivus
49199,when do the cleveland
49199,when's christmas you bitch
49199,when is christmas
46361,what day is easter
112714,any app
36973,when did the pixel 5 come out
134049,what part of america is kentucky located
134049,which continent is united states located in
42415,what is the initials for singapore
35904,9451 house on zillow
35904,9451 morgantown
77140,how many doordash violations do you get before you're exterminated
246695,ghost brothers lights out
114249,what is the substitute for eggs
114249,what can i use in substitute of eggs
49178,does the mail run on president's day
171990,what is the number for elkton clinic
185774,what color does blue and yellow make together
227969,what is the measurement of 6 ft in centimeters
227969,what is 190 lb in kilograms
99681,how do you spell entrepreneur
250400,what's 35 - 14
250400,what is 81 * 3
250400,what is 243 * 3
95714,okay google
54621,i got to go wash my butt
252585,how do you spell downey
133997,do you know anybody
261691,what is the definition of nationality
113339,how do you spell aesthetics
184128,how do you spell moissanite
103201,pictures of a mask
67273,how do i convince my girlfriend to let me motorboat
22818,she doesn't look she doesn't want to look at it and i see it no
227307,what kind of ambient sound can you play
175670,pick a number between 1 and 365
49540,who's the main actress in labyrinth
31849,is it okay to pour boiling water down the sink
272646,162 in zl
70338,the problem so
212992,open vienna
188326,can you feed my cat
87781,find petrol stations
88179,what time do you need it babe
152607,control this picture
152607,don't show this picture
135509,how many cups is 1 l
265109,cvs
261803,five below
282136,car wash
197985,7431 cimarron gap
36828,chase atm near me
234822,digiorno cooking instructions
227261,what's the alarm for tomorrow
227261,david speaker
273301,cvs near me
214433,well
13758,how many pounds is .994 kg
13758,how many pounds is 994 kg
13758,what's 2.2 * 7
202020,what's a mushroom tattoo
191688,yes yes yes
77433,how many new cases of covid-19 today
85417,what sound does an ice cream truck make?
85417,four
44197,how many tablespoons in 1 cup
272834,natalie
43069,maybe i can get that set up
72742,how many pounds is 1.48 kilos
229818,bye
59201,clark the shark
44164,what are the chances of rain tomorrow
267313,page up
267313,jack in the box
37607,paper bag princess
171075,keanu
260372,what's the bump in a baby's head called
260372,what's the dent in a baby's head called
270727,girl hero
270727,ulotrichous
124674,five-minutes
133362,when do snakes shed their skin
133362,what is the snake sound
133362,i want another animal sound
133362,frog
133362,eagle
133362,what's the animal of the day
133362,what is today's animal
133362,what's what's
133362,ostrich
133362,lion
133362,what does a bat sound
133362,at once
133362,what does a skunk sound
133362,5
64308,jingle bells
64308,you a merry christmas
32031,we need poo poo gum
54007,26 cars cannon drive
197721,8 oz cream cheese is how many grams
72559,who did jon favreau play on friends
125771,main floor hallway off
141161,sound down 10%
105728,i'm on my way
29380,grandma
29380,yes yes yes
187071,what noise does a t-rex make
111860,when will it be 2:23
181265,thank goodness ok google
181265,what is peloton share price
181265,show financial stocks
63560,how many books are there in the dresden files series
49182,stop she doesn't know what she's talking about me
99903,stop toddler
142756,what sound does a horse make
142756,what sound does a what sound does a cat make
142756,what sound does a monkey make
142756,what sound does a chimpanzee make
142756,a giraffe
142756,a dog
142756,this morning
144000,why is the sky blue
242448,when is anne diamond coming back to gb news
103626,stop footballs for sale
