session_id,query
27793,make sec
27793,make sick
26845,ok google start the morning with some french accordion music
46679,search youtube for a message to my ex girl
59907,where in my timers
137425,ok google call phoebe
137425,ok google whats 1 + 1
137425,27 * 3
182138,alexa set volume five
194796,when will it next rain
215947,can dogs eat chia seeds
29932,coles west pennant hills
212748,can you call my phone please
212748,no the earth 21
209193,ok google drive to ball point reserve
191456,can i wash a squishmallow
17836,how old is katy perry
91367,how fast are 5g networks
187782,is there any integration between google home and marital aids
191921,was michael jackson gay
229275,how old was tupac when he died
281696,blue room speaker
54497,what's 80% of 25000
47089,how many quarts are in a gallon
47089,how many penises are in a gallon
189472,morganton news
121931,how many legs does a crab have
44747,are chimpanzees and bonobos the same thing
44747,why do bonobos exist
44747,did jane goodall have a baby chimpanzee
44747,is hugo eric louis van lawick have chimpanzee
44747,was tarzan a real person
44747,was george of the jungle real
44747,can gorillas talk
133902,how old is thom yorke
41692,what's 5 / 8
41692,five
41692,what's 61.25 - 36.625
41692,what's 24.625 / 2
41692,what's 3125 as a fraction
134372,what's a cd bar
186449,weights set
186449,check the wi-fi
189398,charlie banana
213723,chicken cooking
70778,heading alexa something
70778,put kettle on sitting here
211463,24-hours
78384,12 x can find in a hobbit
107667,medium
266334,tomorrow i want to smoke on my own
25347,open camera
193139,number 3 entitled you
63814,the pictures that have the last time i posted them
63814,open hmrc
18402,what's the zombie film where the guy that's a zombie
18402,show me a picture of the guy from warm bodies
18402,show me a picture of yennefer and triss
148210,-100% white
268304,sweetheart
225727,what is turbo news now
225727,what is joe rogan's name
225727,what is joe biden's name
15851,eye palette
108983,hurt you like that
23016,11 stone in pounds
153113,define sweet
153113,define sweetheart
211396,when is the 4th of december
211396,when is the 8th of december
211396,how many days till christmas
211396,please give me three
211396,when i stop
211396,nearest co-op
100383,36 x 45%
37745,how many steps have i done today
37745,what happened on this day
67546,$8 in pounds
67546,can a woman be a freemason
254430,50 $50 in pounds
188406,is bread vegan
229826,what names are illegal baby names
232786,how many sugars does chips have
232786,how many sugars are in potatoes
232786,how many sugars are in potato chips
232344,temperature for tonight
189962,who did arsenal play today
71805,when is super bowl
71805,when is sea salt open
55243,313 hours in days
99196,weston fc football
230467,is sea salt open
186829,what's a cosmic you
186829,what is the definition of a cosmic year
197701,what foods can you find iodine
99088,what's miley cyrus's
99088,what's miley cyrus's net worth
130186,how can you tell when a snake plant needs water
130186,how can you tell if a snake plant needs water
145074,should you massage bio oil onto stretch marks
145340,how many millilitres are in an ounce
145340,what is 3.2 kg in pounds and ounces
145340,what is colic
261818,what is 140 lbs in stones and pounds
261818,what is 140 lbs in pounds
77846,show home screen
230201,when's the next day to be sunshine
230201,is june 5th a summer yes
288556,how many liters in a gallon
140539,how many quarts in 1 1/2 gal
140539,how many cups in a gallon
139324,20
150791,how fast can a cheetah run
261578,i think i will i like that
261578,one
13772,how long until the 29th of august
13772,how long until the 6th of december
13772,what people around at the same time as megalodon
193923,why are the tip of aeroplane nose is so sharp
193923,why are the two
193923,why are the tip of slow
193923,what are the typical snow aeroplanes noses so pointy
193923,what are the typical slow aeroplane so sharp
193923,how slow are small air fryer
193923,tell slower big aeroplanes
193923,how's siri are the silliest planes on earth
193923,how silly are the silliest planes on earth halsey are they
194558,what type of rocket is launching today
194558,what's rocket is launching right now
194558,what do rockets look like today
194558,please can you tell me what rockets look like
194558,please can you put on a spaceship on telly
194558,put a picture of a rocket on youtube on family room tv
194558,when can you get married
194558,when do people get married
194558,how many months until the 29th of august
194558,what's 4 weeks
194558,how many weeks until the 29th of august
194558,i'm bonnie hello
194558,what are voicemap set
194558,which episode is mimikyu on pokemon
162997,bye bye
162997,toy leaning tower of pisa on youtube on family room tv
99853,how many ounces in a cup?
261800,who is kimberly wyatt
107419,can i turn on tv
187630,what are the pollen levels today
187630,what is today's pollen count
232239,are you alright hun
193211,translate lundi
239748,heroes real
239748,are superheroes real
72967,do you like canadians
46365,is there an accident on the way to work
77457,how many feet is 80 in
58238,laundry room
149311,blood work
205099,what level does fletchinder evolve at
69441,what level does shellder evolve at
69441,what level does houndour evolve at
69441,what level does panpour evolve at
69441,what level does barboach evolve at
69441,what level does venomoth evolve at
112515,when is the next alberta election
194767,what is stagflation
195835,this guy i turn off all the lights
76818,how much is 7 british pounds in canadian dollars
107760,how much is 3.75 british pounds in canadian dollars
107692,how much is 3.75 british pounds in canadian dollars
263123,how can you lower your body temperature at night
152938,sports research college in high class protein peptides
123470,how much is 46 british pounds in canadian dollars
30427,how much is 199 chinese yuan in pounds
133823,what is world funk rock
133823,what is fumpa in english
164274,italy experiment
45373,what's the 1 degree
15869,what was the score between tottenham and sheffield united
211782,is the samsung s20 ultra dual sim
46932,who is west brom's goalkeeper
46932,who is scott carson
273116,when is tottenham hotspur playing next
70007,tell tech ace to write up
235732,who is duplo made by
233734,what's the net worth of disney
269889,very main bedroom off
66791,how much is 114 chinese yuan in pounds
234684,how long do goats live for
234684,how long does a rabbit live for
234684,how long does a ram live for
45475,what is 87% of 15
238566,is there a chickenpox vaccination
53505,how many weeks ago was the 30th of september 2019
55073,what's 600 / 70
251235,how much is 2 m in ft
94798,what's the latest real 2020 score
232651,what's the population of cyprus
112823,what's 200 yards in miles
77016,how many people live in tamworth
227594,what is 6
227594,what is 6000 mg in grams
205528,when was adobe photoshop released
163125,how much do you want the window shut
163125,tell me famous london buildings
77581,that way
147589,my heart
84327,when did jurgen klinsmann join spurs
84327,when did klinsmann play for spurs
53381,what is the name of the actor that played slater in only fools and horses
187765,what's 2350 minutes in hours
132704,what's 293 lbs in stone
133377,what is a normal heart rate for a man
267620,how many people in the uk die from flu every year
133720,how many ml in a uk dessert spoon
42076,who's the oldest person in the world
42076,quiet in the west
231479,how far is tilford woods from tamworth
193182,what's the definition of bully
182160,when are tottenham playing next
72844,what's 135 kg in stone
72844,what is my next reminder
274818,do a coin flip yes personal
274818,do a coin flip
274818,what's the chelsea score
256457,before she said ok google
147556,two off
35199,is tamworth north east england
58219,what is pneumonia
18433,what's 70 centigrade in fahrenheit
53957,when is tottenham hotspur playing next
229391,when are tottenham playing next
131479,what is 40 lbs in stone
92585,how much is 3 mm in centimetres
125870,what's 176 g in ounces
30875,what age do you have a bar mitzvah
26584,can you freeze fizzy drink
232578,what's 23 in in centimetres
30062,what's the arsenal score
210262,when's arsenal playing next
44019,what is a truffle
57958,show me home cctv
263814,when is tottenham hotspur playing next
52537,what is charles beach is net worth
52537,what is ksi's net worth
54285,what's 285 cm in metres
229531,what's $64 in pounds
229531,what's $123 in pounds
151183,what is 900 baht in british pounds
16354,what's the liverpool score
194934,does honey contain sugar
194934,how many carbs are in honey
154518,what's 170 chinese yuan in british pounds
88058,how far is nottingham from tamworth
54022,how do you spell madeleine mccann
288493,when is tottenham playing
24698,how many carbs are there in a can of pepsi
152576,what is 3 m in feet
268428,what is 2 and 1/2 hours / 7
132509,what's 40 lb in kilos
209440,can you get electrocuted from a tesla coil
102936,how do you spell unmistakably
102936,when is tottenham playing next
33264,sarah birmingham top sports bra support
45369,when is tottenham playing next
232474,when was braveheart the movie released
234491,what's 580 dirhams in british pounds
116135,where is my local b&m store
116135,how far is minions way from my home
116135,when is tottenham hotspur playing next
264868,can you freeze swede
209216,when was slavery abolished
37311,what's 5.9%
94396,what's 140 months in years
23497,plugged in
203657,when was the song german whip brought out
203657,when did meridian dan bring out german whip
134386,when is tottenham playing next
36651,what does acl stand for
27406,what's 34 chinese yuan in british pounds
36282,what's 699 in pounds
46164,what's 13 amps in watts
201650,what is 30057 chinese yuan in pounds
75798,how many grams are in a uk mug
75798,how many grams are in a cup of rice
75798,how many cups of rice
69613,how far is euston station from elephant and castle station
69613,how far is euston station away from kingsbury station
11875,that number
27164,what's the arsenal score
73642,animal today
16058,wolf
61184,what is a
127378,how many days until valentine's day
91419,what's lethargic mean
102776,how do you screenshot on a chromebook
265581,how many different kinds of dinosaurs are there
189640,like 5 and general in the foot
199230,who was the thunder from down under
199230,who was nicknamed the thunder from down under
18527,how do you spell no no no no no no no no no no no no no no no
75536,how to regain root after upgrading to android 11
233799,what year did can i kick it from a tribe called quest come out
199612,what year was the song got your money by ol dirty bastard released
199612,what year did ol dirty bastard die
199612,what did old dirty bastard die of
102639,the three of you should have
291132,what is 200 degrees celsius in fahrenheit
291132,what is 45 degrees c to fahrenheit
251541,what is a beep
251541,what does nvm
251541,what is beep mean
246249,what is 35 mm to inches
33276,negative
105042,black friday trail
157321,how do temporary tattoos work
157321,enough now
52981,can you lay under it
7265,where's the 14th amendment
7265,what is the 14th amendment
7265,what does the 14th amendment say
234577,cosplay
234577,yeah hey google couch light
174669,dog
174669,fruit snack
187762,what is the largest city in the world
289086,what's 10 *
289086,no never mind cancel
137664,30 cm to inches
147482,what is r
147482,what is the letter thorn
147482,speak in spanish
147482,no hola
147482,ceramic musical
147482,musica de cm
147482,music aniceto misa
147482,translate to russian
147482,stop talking in spanish
164009,cosplay
273674,what is the pufferfish eating a carrot meme
61800,can i send money through the facebook marketplace app
2644,how many bones does the average human have
273167,what is the rarest gemstone
264390,4 tbsp to cups
197318,what kind of moths come out of bird seed
24470,search
24470,what's the end of the day
24470,what's the animal of the day
24470,when does the walking dead return
187672,what is the most common consonant in the english language
102586,how many kids did tupac shakur have
152478,at what time does costco close
190992,how long
89959,how many days until december 1st
131488,2 minute one
25921,can i call my google home from my cell phone
25921,can i make a phone call to my google home from my cell phone
25921,why do some us plugs have a t outlet
25921,what kind of devices use on 20 amp plug
68660,how old is warren g
68660,what year did nate dogg die
68660,what did nate dogg die of
68660,did lil kim
68660,did suge knight represent the east coast or the west coast
52723,what are toilets made out of
234256,how do you spell ninja kidz
27672,i'll check
131566,is it easy to make money in self storage
227428,what is moore's law
228411,what is a dst
228411,what is 30 km to miles
99645,how far away is sandy ridge reservation
107733,how many days until november 2nd
208795,who created sweetest day
29780,how many people have landed on the moon
232894,baby it's you
233922,how many days until christmas
227589,metal quiz
227589,suicidal
227589,black sabbath
227589,pantera
227589,corpse paint
202543,what is lily's bottom
202543,where is the bog of allen
202543,how much chuck could a woodchuck chuck chuck if a woodchuck could chuck poop
202543,what is chuck-e-cheese like
202543,how much does it cost to fly to japan
202543,do a 30 pupus
202543,how much chuck would a woodchuck chuck if a woodchuck could poop
202543,can you call my phone
64743,camper
290200,pamplemousse is grapefruit in what language
290200,will there be a ted lasso season 2
236416,hot water drop off mason at promenade khan
156647,how long does it take to get from pleasant grove to rexburg
228075,make my pixel for a ring
273830,find jeanie pixel 3a
80989,fertilizer
112311,do honda civics have a cam belt
153160,bed sizes
52915,when i google
234052,what is captain america's full name
234052,give me a list of boy names
234052,give me a list of boys names
245173,what sound does a chicken make
245173,what sound does a parrot make
245173,no hey google call my phone
148237,how many cups are in a gallon
148237,how many liters in a gallon
15685,4
15685,both
15685,kid's room speaker
197584,what's the eminem song about michael jackson
80756,kid's room speaker
52722,how much did it snow
227846,who's the actor who plays daryl in the office
227846,how old is craig robinson
110844,open waze
289279,when does the first episode of miss marvel come out
130273,how long does it get to salt lake from home
3549,how many blades of grass will grow from ron grass seed
152780,what type of oil does a 2012 kia sedona use
152780,car oil for kia sedona 2012
263161,fancy name
263161,have you beautiful girls to catch a book
263161,i do not
263161,can you make a nickname for my wife
263161,can you make a nickname for my friend
263161,short name
263161,no way jose
193996,do babies hiccup when they're cold
177682,does hydrogen peroxide melt ice
194485,what's 36 / 1.5
188378,do you need a passport to buy international plane tickets
197773,when is mother's day
11981,what is 30 * 30
102191,how often do you change transmission fluid
39302,speak english not korean
20758,how do you know if someone is angry
20758,why do people get angry
13818,the ant song
188827,bts dynamite trailer
188827,bts permission to dance
246550,what does a baby make
99309,no alarm please
64639,no i didn't even notice
99255,let me in
133366,how you like that by blackpink
61676,is tom selleck gay
214466,cigarettes name
93692,how do you spell the tool planer
142249,keanu
277235,guess i'm going to do that for the rest of my life
46605,i'll get out
14287,causes fog
153117,movies
263382,what song did ed sheeran supposedly plagiarized for strip that down
263382,what song did ed sheeran get accused of ripping off no scrubs
263382,what part of no scrubs was ripped off shape of you
263382,well okay
199890,and when did she die
199890,what year did bad wolves cover zombie
199890,what year was that
199890,who's the lead singer of the cranberries
1139,what are the names of the fox and the hound in the movie
1139,what are their names
152799,cool thank you
29674,which president said i cannot tell a lie
227658,the rose river garrett johnson
227658,can you help me to get my guitar
227658,can you help me tune my guitar
197552,what day of the week is today
133235,a 1965 dime stuck on a quarter planchet
133235,i have a 1965 quarter with a very light stamping of a dime on it
133235,what is nevus of ota
133235,what is port wine stain
17227,1982 penny no mint mark
69480,is is having a mandatory safety meeting during the lunch against the law
98018,i would wait for the countdown on trl cuz that would be on the countdown
292014,when i asked
116595,birds in a jumbo strawberry dr pepper with light ice
68018,he was using the dry ice to get the screen off
234580,how much does an egg weigh
234580,how much does an egg weigh in grams
234580,how much is 1 ml of water in grams
231299,master bedroom on
198519,let one off
228413,let one
256699,porto
256699,stop hey google
201083,talk light
143447,porch
37172,media volume 50%
104944,what was this bug
104944,what resists bug
28657,what is odin the god of
233905,phone tv
233905,f one tv
73030,mommy on netflix
73030,abominable
77014,mako mermaids
206720,the sandlot
234994,only murders in the building
236089,hook
46706,dick's dick's sporting goods on route
55235,godavari indian
161478,engel bau
212641,where'd you go
214416,what's $130 / 4
214416,what's 120 / 4
159789,how long is walmart open
266383,when does walmart open
266383,how much is the euro worth today in us dollars
266383,how much is the dollar worth in euros
266383,how much is the euro worth today
233800,can an apple watch be charged on a regular wireless charger
190739,how do i record audio and then play backwards
190739,how do i record audio
149236,what's the formula for the area of a rectangle
149236,how can i download a facebook for a video
189068,how much promethazine can a child take
230051,what's 30% of 1400
253833,define pheromone
63622,who's the prime minister of israel
63622,does the united methodist church have women ministers
234566,what's the chief what's a chief petty officer in the navy equivalent to in the us army
37556,how much is 24 united states dollars in zimbabwe dollars
37556,countries with high inflation
37556,what is $24 worth in venezuelan bolivars marion
37556,what is 24 us dollars in venezuelan bolivares
124219,what day is september 28th
198375,like that
198375,she knew her
198375,schick
112713,did signal mountain middle-high school win against marion county
18117,what's the number for fresh burger restaurant in soddy-daisy
243189,time is left
107833,where can i find glue
6432,what's 16 * 42.97
226077,what is 18 million divided by 61000
134261,what is the cheapest place to buy rat traps
172795,who is the african american lady that refused to give her seat up on the bus
31070,is mcdonald's open on thanksgiving
31052,search for an image
3408,what's the telephone number for freedom mortgage
3408,look up the toll free number for freedom mortgage
154086,what is the time in american samoa
154086,what is the date and time in kiribati
154086,what is the time at the international date line
154086,what is the time in international date line east
183510,what's 94 / 12
175346,how old is fran drescher
215232,what's the name of the queen in a bug's life
215232,what's the old gentleman's name it up
215232,what is the old character's name in the movie up
77306,can i give my 10-year-old daughter one tablet of ibuprofen
77306,can a 7 year old take 200 mg ibuprofen?
16049,look up southern adventist university
16049,look up southern adventist university course schedule
76762,how many days is it until august 1st
131804,car wash in the area
110253,what's rabbit in latin
26716,the money off of it
99705,when did angela merkel stop being chancellor of germany
26799,how old is michael mcdonald in 1993
26799,how old is michael mcdonald now
26799,how old is kenny loggins in 1993
36483,how do you spell bourgeois
36483,kept saying oh you have much better equipments in america than the germans in any way in germany you have much better computer equipment much better like you know teaching this that i was like okay you realize that you are in the most like
36483,what does f i l i o q u e mean
161284,how much is 655 in dollars
99301,what gender is flam in german
27182,does bactrim kill strep throat
172643,how many miles how many kilometers is 25 mi
172643,how many kilometers is 12 mi
172643,how many kilometers is 13 mi
172643,how many miles is 25 km
269558,open gmail
13786,can you turn around
269371,show me a picture of a tambourine
269371,show me a picture of a maracas
269371,what's a picture of a lizard
98410,show me a picture of indian corn
147402,placement.
132294,can you call him and tell him i'm driving
256167,what's playing on grit tv right now
14087,who does natalie morales play in parks and rec
54958,the longer the rice cauliflower rice
53049,alright
53049,i turn my google speaker off at every time i do it
273237,final
132149,what's 200 / 3
31774,what's 450 degrees in celsius
260448,who plays olivia in law and order
260448,who played olivia in law and order
187014,how much is 8 oz in grams
228173,what's 1439 - 380
267576,can i use quorn on the fast 800 diet
192822,how to cut up a mango
81775,how long do stock take to soften from the fridge
81775,how long does it take to soften butter
81775,which direction does the sun rise
81775,where does the sun rise
212211,what train do you get mahogany
17165,do you youtube
187431,stuff up
187694,continue youtube
187694,continue youtube from xbox
43325,when's the timer go off
154412,what's 330 degrees f in centigrade
80483,what's 35 x 12
226832,how long does a yankee candle tea light last
282113,what's $120 in sterling
258177,how much is 4 in in centimetres
29866,which area of england is bath
77310,why does my cake split when baking
235193,when is my next meeting?
98160,at 4
98160,how long does frozen fruit take to defrost
232285,what's the name of the barbarian in the discworld novels
232285,what is genghis cowen's daughter's name
232285,what is the name of the daughter of the barbarian in the discworld novels
232285,what happened to to flour in the discworld novels
232285,what happened to the character to flour in the discworld novels
232285,thanks baby
25571,how many calories are in a soft-boiled egg
25571,how many calories are in an egg
31317,about saturday
86836,are post offices open today
86836,are post office open today
149217,how long on my timers
7513,how long is the runtime for the film banshees of sharon
7513,what's the name of the new colin farrell film
7513,how long is the movie banshees of inisheer aran
234583,show alarm volume
234583,what's the alarm volume
102602,how many calories are in 300 ml of vegetable soup
102602,how many calories are in one portion of salad
230798,how long should i cook sausage rolls for
230798,how long does sausage meat take to cook
71480,how long does shortbread last for
71480,how long does millionaire's shortbread last for
87877,what's the chemical symbol for titanium
23851,when's fathers
138680,how long do doughnuts last at room temperature
124295,what's 325 f in c
124295,what's 325 f in
225674,drive it
5064,when is father's day
5064,when is fathers day in 2021
193547,how long does it take to hard boil eggs
193547,how long does it take to hard boil an egg
193547,you tell me google
193547,give me a deviled egg recipe
193547,instructions
193547,give me instructions for deviled eggs
193547,make.
25990,can dogs eat green peppers
230887,cobb county tag offices
98690,corner market on appalachian highway
288002,lucky china
288002,soul food nearby
92100,little caesars nearby
92100,innovation compounding
186938,uber
240585,what are beef tips
256538,what's 300 * 8
188836,how much inches of rain does a chaco
188836,how what's the precipitation in north georgia per year
263613,is cauliflower
264699,when is the rose plants
102325,put white noise on
269322,do i nice
188818,stop youtube
38188,next to you
247746,coffee
287464,how far is the earth from the sun
287464,how many miles is there from the sun
287464,ok google what is the conversion of 151.34 km in miles
194214,what's 216 / 26
8800,how do you spell among
266561,how do you spell wife
17446,what's the fear of long words
87731,how old was the girl with the milwaukee protocol
208434,what is a patrick's day
208434,when are the ides of march
182908,what does apple of my eye mean
214711,10:30
198344,in her gave me a six
83476,how many how to train your dragon movies are there
102294,when is april fool's day
44813,how's the lindner spelled football
44813,how do you spell cylinder
44813,how many days until april 29th
41614,how do you take a screenshot on a chromebook
98139,how do you spell quesadilla
198485,where is frightened a streaming
204297,how do you spell shield
204297,what temperature do i cook salmon
125501,how do you spell dwarf
22601,where's my package
187807,stop play play new nae play without the music of music
197376,do a backflip
197376,that's not how you do a backflip
197376,does jeff bezos have kids
197376,how far is lenexa kansas
197376,how long would it take to drive to lenexa kansas
74690,don't listen to a song
74690,stop hey google how many days till july
74690,how many days till july 28th
74690,how many days until wednesday
74690,how many weeks until july 28th
74690,how many days till july 22
227840,how many days till july 22
227840,how many days till july 28th
231782,yeah i didn't know
106807,what month is it
197496,what year was that tom holland born
257795,how do you spell rhythm
229490,dad
38218,when is national athlete
53823,how much money is there in the world
53823,who's the richest man in the world
53823,is bezos the richest man in the world
