session_id,query
197671,find the first clue fast food
93956,how long do you boil an egg for
71956,identify this song
288275,what's another word for yearning
227793,what's 1/4 of 250
227793,what's quarter of 500
227793,study light 100%
131407,how old is my phone
231367,8:00 PM
231367,show active subscriptions
89498,open my schedule
145008,see cart
22555,jamaican soup
281724,what's a chicken say
18196,best formula for gassy babies
54442,what is sound should you say hey google what is shaken baby syndrome
54442,what all grain damage
54442,update your brain it's called bradenton
38865,what is the average size of a moose in new hampshire
38865,what is the biggest moose ever shot on record in maine
38865,what is the biggest land mammal ever shot on record
38865,what is the largest mammal
38865,how big are they
38865,how big is that in pounds
81823,oh shut up go away
238696,we do we do i got
130837,how many hours per pound for my turkey
45646,how many hours in a week
45646,what's 168 - 48
63584,put plex on samsung tv
85389,is a banana a fruit
73647,keep trying to be wrong
125087,what was the chinese animal for 2012
173353,no correct that change it delete it
24040,how many calories in a strawberry
24040,how many calories in peanuts
137814,what are the things on end of a shoelace called
272906,what noise does a woodpecker make
272906,no it wasn't
272906,what does a rats heart beat
272906,what's the heartbeat of a horse
272906,what's the heart rate for a blue whale
272906,what's the heart rate of an elf
272906,no interested
272906,how much is the heart rate of an elephant
286458,what is a glaive
286458,glaive image
44780,should i turn the boiler off when i move out of the house
88543,remove mixed race
212188,how long will it take me to cycle to work
212188,why have you not updated my address from google
172096,when do bowling for soup play in glasgow
81283,how bad is the wind today
62835,can i put light bulbs in my recycling bin
62835,can i put led light bulbs in the recycling
31337,what's 300 x 30
17105,nice to meet you' in chinese
17105,how much wood would a woodchuck chuck if a woodchuck could chuck wood
17105,give me a random trivia questions
17517,konichiwa
17517,candice
17517,on my desk
17517,tori disco
17517,is it a white bird
17517,arigato gozaimasu
17517,sorry on again
207376,when are the platinum jubilee bank holidays
55427,how long to get to work
43578,what do you call the fear of cats
43578,what do you call the fear of the number 13
266540,ignore me bitch
129725,can you take a cigarette lighter onto a flight
254689,define the word wi-fi e
254689,define the word f i e
266482,what's the traffic like on the way to work
261573,should i wrap a potato in foil before putting in the oven
261573,what is 425 f in celsius
3442,just stay here
53121,that's not what i said
211679,where are the nearest public toilets
211679,where are the next services on my route
211679,where is the next service station on my route
144265,what does a piercing in the top of the right ear cigna
144265,what's the difference between a superlative and a pejorative
53226,percent
46366,can i dry laundry outdoors in cold weather
213603,how long does it take to bake a potato in the microwave
89770,i forgot
202575,how heavy is a barn owl
151068,who played the father in home alone
154543,tina fey young
188056,pick 5a for $400
107674,what is hosomaki
194522,what's the oldest language
192792,don't tread on me
255263,almond nutrition facts
255263,anti-inflammatory foods
255263,what is the number 1 inflammatory food?
74586,who's your mom
226678,"no more than $100,000 a day"
230419,what do leather workers in minecraft get linked up to
230419,what are you look up what do you use to make a way to change what do you use
57402,execute order 66
15389,whats 1 + 2 + 3 + 5555 + 6
247428,socks
103772,seriously grady
6286,who is kfs
6286,who plays the jesus in the tomb
6286,who placed jesus in the tomb
48045,when does loki start
208988,are green olives good on mexican dishes
208988,are green olives good on enchiladas
55978,how many hours has it been since 1:00
55978,how long is the rain supposed to be today
31798,show us who the nearest walmart
31798,show us to the nearest place with patches patch stuff
31798,show us the places with the nearest winflo patches
69313,weight off ruin it
69313,a broken can you hear me
131901,is led toxic to humans
203590,don't change it
203590,never play this again
227784,it's plays everywhere
187695,how old is 2 years old in cat years
187695,how old is 7 years old in dog years
187695,what's 2 * 2 * 2 * 2 * 7000 * 2
44231,what kind of pizza
231438,choose show me some videos on how to make an origami stocking
220184,is it an hour and a half
230639,who's your favorite serial alexa or google
43863,what were the temperature be outside tomorrow in malinta
146277,can you put ducks and chickens together
193851,what does utility meets mean in cuts of beef
112569,stop you got flip flops
212689,nearby me
54670,watch survey line
107319,97.1 the fan
32957,what is standard x stand for
32957,evening
32957,komodo dragon
32957,spoil a surprise
24709,what's 15 * 15
24709,how long is 225 cm
24709,how long is 2.25 m
24414,how long do fresh mushrooms stay good in refrigerator
24414,how long will sliced mushrooms stay good in refrigerator
52952,who made this song
126520,when do we spring forward
73960,price
260421,do you have to be there by 8:45 at the latest
66065,what kind of snacks can you give chicks
250046,what's a replacement for chili flakes
112770,start flag india
112770,start vlad the inhaler
27924,what's 24 * 12
188098,220 - 60
256183,indigo play beyonce on iheartradio
233521,what's a skunk ape
233521,okay thank you
157709,when did the video game dark souls release
44582,the phone number in just a lot of government documents annual report of the secretary of internal affairs
130748,what's the floor lamp
92820,what does hedonic mean
92820,where's the mojave desert
92820,what's the biggest city in the mojave desert
90317,7:15
184888,postpone
229903,just let me know if there's anything
229903,get me a
254450,sur la tv
127665,warmane
239356,when is labor day
281577,are there any other apis we do in photos bookings and they are also being shown here
60951,city of allen
65757,hopscotch
36322,can you connect to my phone
155930,when does dollar general close today
255252,browser
255252,web browser app
255252,web browser
255252,browser app
255252,open earn app
109557,what's 3 - 1.4
234502,what's 35 ml in fluid ounces
234502,what is 35 ml to fluid ounces
234502,35 ml to fluid ounces
17595,how many days are left in the year
49272,how many calories are in casey's garlic parmesan sauce
195072,quick
195072,twitch
46284,what is 75 pence in pennies
46284,how many us dollars is 75 pence
46284,what is 0.75 british pounds to united states dollars
246514,make that 30% instead
31629,170 / 30
31629,170 / 15
131572,16.9 * 2
180769,32 / 12
129654,what's 681 g to pounds
261006,2/3 cup to fraction
261006,2/3 to fraction
261006,2/3 to decimal
190100,how many days until august 31st
231261,how long does it take a person to go from slightly gray to fully gray hair
231261,at what age is a woman fully gray
230531,what is the cost of a bathroom fan
73284,how do you spell peruse
95091,how much does gas cost per mile
95091,147 * $0.15 is what
75510,open drive mode
241071,how much time is left on the meatloaf
160038,how many calories are in a normal spoon
160038,how many calories are in a scone
160038,when's your birthday
263113,leave a family note
39293,the cw
24793,what are some aggressive dog breeds
46107,when is dusk dusk
17689,impact auto
83481,how many calories in one dragon fruit
284365,how many days until june 14th
146708,the untouchables
78367,this is spinal tap
6735,shows like grey's anatomy
6735,shows like grey's anatomy on netflix
88158,time movie
58902,mrs. doubtfire
187289,the world according to garp
187289,the fisher king
23076,how long does shrimp cocktail last in the fridge
23076,what is the month and day and year
23076,how long do strawberries and blueberries last in the fridge
23076,how long is watermelon last in the fridge
23076,how long can cut watermelon last in the refrigerator
23076,ok google how long can fresh chocolate watermelon last in the fridge
23076,stop ok google only reply using kitchen device
82862,is a negative plus a negative a positive
82862,if you add two negatives to numbers
82862,what is -22 + -49
230154,what is 2/3 + 1/6
160838,how many days since june 18th
272106,what changes need to be made
272106,stop ok google to cook cinnamon rolls at altitude what needs to be done
140125,how much timer on cinnamon rolls
201095,how many days until no
32603,at what temperature and how long to cook pumpkin seeds
32603,how long to cook pumpkin seeds
92529,how do you spell cocoa
22340,should five pie dough crust me needed
22340,should pie dough crust be needed
22340,do you have to knead pie dough crust
247845,can dogs eat turkey
247845,can dogs have turkey
29132,can dogs have turkey that was baked with rosemary
67089,can you freeze philadelphia cream cheese
107539,how long can shrimp cocktail last in the fridge
107539,is covid brain a real thing
107539,what is covid brain fog
107539,what are the effects mentally of covid on the population
107539,is coronavirus still happening
7972,how many tablespoons in a third cup of butter
197697,what does kuiu grass look like kikuyu
197697,is kikuyu grass invasive in walls
248893,do tomatoes have protein
248893,ok google are tomatoes a protein-rich food
248893,are tomatoes rich in protein
242373,what is the temp right now
37033,how many cups is 8 oz of cream cheese
37033,is cream cheese able to be frozen
186964,can dogs eat raw chicken
90357,when making shredded potatoes for potato pancakes do you put the potatoes in water
90357,can potatoes be shredded ahead of time for potato
90357,does vinegar water stop potatoes from going brown
42522,how much has wood prices gone up in the last few years
42522,240% from a year ago
42522,how long does it take for liquid nails to dry
42522,how late is home depot open today
31348,this is switch off
144768,what does chide mean
192305,list of foods that cause high cholesterol
192305,what foods cause high cholesterol
60589,how many days until mother's day
60589,how many days has passed since mother's day
183333,the lost city
29075,how many days until august 8th
88886,how long to bake cod from frozen
236276,how long does it take for pears to brown
27894,how long to cook rice pudding
61354,what does feliz navidad mean
104600,how often does the exterior of a home have to be painted in colorado
115763,is trepidatious a word
115763,is trepid a word
16203,how long can lasagna be frozen in the fridge
206284,how long do roasted pumpkin seeds last in the pantry
110232,what is scalded milk
132086,i doubt it was that
193360,how much onion powder equals 1/4 onion
193360,how much garlic powder equals 2 cloves of garlic
234720,lower office light by 50%
190942,how long does asparagus last in the fridge
193303,can dogs have cucumbers
193303,can you stop talking
207775,are crocs still produced and sold
233567,is it best to soak sweet corn in saltwater before you grill it
182542,how many hurricanes has florida had in the last 10 years
56314,how many weeks until february 1st
132592,is light cream half and half
290477,how to know if chicken is done
290477,show me a couple of ways to check if your chicken is done or not
290477,tell me without a video
24299,how many years ago did keurig become popular for everyday home use
244768,let me think
74347,stop volume
74347,max volume
195400,storybots
193744,are blueberry yellow yes or no
264494,is it cloudy right now
144953,can a 6 year old learn how to play the piano
144953,can a six-year-old play an acoustic guitar
144953,can a 6 year old play a guitar
144953,silly google
71219,how many glow sticks would you need to get to outer space
71219,what sound does a monkey make
71219,yes but i would like to hear it later because because my mom wants the side of the way
159227,what does an inside of a hey google
83284,how long would it take sound to travel from the earth to the sun
128219,what is a catholic relic
234096,spelling
71908,what color is the sun
113883,does monkey always win
231635,poop
20742,how full is the moon tonight
28701,can you talk louder
256444,show me a picture on my phone of great britain
256444,show me a picture on my phone of london
146545,what year was the national velvet movie set in
146545,what country is national velvet the movie set in
199169,can you recycle peanut butter jars
199169,how do i recycle a peanut butter jar
185485,has anyone died of strep throat
273043,is the skin an organ
54616,how many players can play overwatch 1
59782,how tall are the what's it called it's called the freedom tower
59782,how tall is the freedom tower in new york
59782,how many people have died in pearl harbor
156010,show me a picture of a turkey paw print
172077,how many satellites are rotating around earth
55654,whats 684 + 237
55654,what is the national park
238967,what does requiem mean
124268,what's stronger in atomic bomb or a nuclear bomb
88658,can we ever be too cold for snow
139171,speak to me in french
139171,can you help me around the home
233063,what phase is the moon in tonight
122274,you're really informative
122274,are you my friend
289006,what is the 70s classic that goes do do do
120986,give me a funky fact
120986,funky fact please
120986,can i have a fact please
120986,how old will i be in 2059
87730,can you manage my calendar for me
227382,can you add an extra half an hour onto that alarm please
227382,can you cancel the alarm that i set please
27968,can you make a scary noise
27968,can you give me a mind trick
27968,can you give can you give me some pumpkin facts
259348,can you give me a mind trick
156201,how do you make a roman costume
44428,show tom hanks
252390,is google a number
287597,which actors are in the new series of danger mouse
287597,can you tell me the actors in the new new series of danger mouse
242471,what is the definition of a rumour
242471,what is a rumour
46607,how do you spell abbreviation
145495,start track from the beginning please
30798,is goat a word
93327,how do you reheat pizza in an oven
68767,how do you cut rhubarb out of the ground
70120,is greenland a real country
102574,when was thomas the tank engine first published
102574,how long has cbeebies been airing for
79381,can you send me some recipes of what to do with going off bananas
236062,can you give me some good 90s pop songs
236062,next track please
25272,what channel is the grand national on
16313,what channel is hearts vs celtic on
227675,stairs snip please
227304,do you google do you lucci
70651,talk talk to you documentaries
70651,documentaries
162000,barry
101749,weaver's way ambler
79087,the other two
255446,the hills have eyes
140052,panna
198716,beef house
151959,comic book villains
130180,pizza originated from where
111963,we just tried to save the
111963,when jeff tried to save the world
111963,superbad
199798,jeff tried to save the work
199798,when jeff tried to save the world
229618,who's the prime minister of belize
229618,the united states brokered a peace deal between israel and who in the 1979 camp david accords
229618,what country currently serves as president of the un economic and social council
92374,are black lights bad for your eyes
238991,face
93166,the jesus rolls
253089,ellen john cold heart
15744,extra-ordinary movie
186280,a hat in time playstation 4 review
78328,tiptoes movie
174730,find me a bank
174730,find me a bank near escanaba
242204,bald and bankrupt
149301,what are the first 10 amendments of the us constitution called
149301,how many branches of federal government does the us constitution establish
149301,what is the fourth amendment
149301,what is the first amendment
149301,how many us circuit courts of appeals are there
149301,how are us circuit courts appeals judge selected
149301,who currently serves as the chief justice
95540,how did jimmy urine of mindless self indulgence get his name
95540,how did jimmy urine get his name
95540,how did the lead singer of mindless self indulgence get his name
194771,talk e-document terraria
194771,hockey documentary
194771,air hockey documentary
58460,attack of the show
102317,salute your shorts
194962,a bag of hammers
227635,find so-and-so store and i'll show you all the locations and stuff
134155,biology science in life
240110,please be quiet
126380,which country was the world's dominant power in the 16th and 17th centuries
126380,what are natural makeup brushes usually made of
126380,what nation did king edward of england conquer in 1283
126380,what country was robinson crusoe published or in winter never mind
126380,what century was robinson crusoe with published
126380,in indonesia what
126380,please be quiet you made me upset
126380,what is tom cruise and katie holmes daughter name
126380,what is katie holmes daughter name
126380,what are the only veins in the body that carry oxygenated blood
126380,who starred in stars and bars in troutman and the postman
126380,who starred in the postman
126380,be quiet nobody asked you
126380,what is the tallest species of tree in the world
126380,which started
193349,into dust by mazzy star
60896,what do bees eat
228940,talk about speeding fines
31139,how long do you have to cook corn on the cob
26786,i said be quiet
88338,can you delete all your photo
88338,can you download all your photos on facebook
165238,what star sign is november
228143,what is a very describe
228143,please describe theory
36975,for 12 minute 1
281769,how did not start die
281769,how did mozart pass away
44043,how long does maritime now going to country
44043,how long has the country mauritania
261668,how many minutes on the alarm clock
74432,what are panko crumbs made out of
53449,how to boil hard boiled eggs
53449,instructions
195165,does indoor mattison have penicillin in it
243153,is it safe to eat expired quinoa if the package hasn't been open
193993,where is the north pole located
193993,is the north pole and russia
193993,is russia
150439,take photo
219623,how long do you cook pita bread pizza
232033,what is 350 degrees f converted into celsius
78370,what's the einstein quote about friends
88989,what are eastern suburbs in sydney
88989,what cities are in inner west sydney
33346,how many minutes do i put rolled oats in the microwave
257627,vietnamese to chinese at 4
257627,do you have needs to change at 4:00
2626,if i'm 5 foot 5 how many centimetres is that
213384,what are the benefits of eating chickpeas
232862,what does lemons help with
232862,yes i do ok google yes
232862,what do lemons do for the body
232862,why is eucalyptus good for you
232862,yes yes google
233852,when's thanksgiving
188231,5
146557,what's 32 oz in cups
225459,repetti carrier
107532,put bluetooth on
129513,bye
197049,sound down
53139,do you think i'm sexy by rod stewart
92411,how long
116901,placepot
27346,who is the super bowl halftime show
170378,or a date
255757,please how you doing
231704,but
71404,stop clyde 1
77818,what age is jay z
188043,how old was john travolta when grease was filmed
218888,how many pints are in a litre
81488,how long is episode 8 of the rings of power
81488,no the rings
23544,how long until the rain
59387,can dogs have pate
187091,what council is croy in
239568,car problem diagnosis popping air coming from fuel injector
154550,1993 chevrolet g20 transmission fluid type
152479,can you use transmission fluid in a power steering pump pontiac aztek
231147,2005 ford focus coolant capacity
233846,bap geon
98939,4 l 60 e transmission how much transmission fluid to put in the torque converter
98939,how much transmission fluid does a torque converter hold
252755,how much does one gallon of fuel weigh
274230,2006 mazda tribute transmission fluid capacity
253672,is
260381,how long does pneumonia last
260381,how long does it take a person to recover from pneumonia
237974,gate home
76664,i forgot the degreaser
197385,ford focus model year tire sizes
269852,ok google nox
28746,i like that
87988,what's on my playlist
87988,go home
232671,make sense
260057,how do you spell donate
125052,what's 213 + 192
16258,is 25
68618,how to make sour cream from philadelphia
145233,should spider plants be in direct sunlight
43845,transport it
58315,does the queen own all the swans
58315,was swans ever consumed as food
58315,what's the average average number of marriages per person
58315,how many people in the uk have divorced and then married
239048,how long does it take to get to main building
31293,why do you rock your life when you cut cheese
112589,do you put coriander in chili
77812,how to store sam ball
78952,forget forget
68397,how to make banana bread?
231999,how long does it take to walk to boots
170211,how big is an american pint
28862,approximately how many green peas are in a kg
28862,cps look like heaven dried beans fried dried lentils fattening
226370,where sprouts
91084,ok google what is the cooking temperature for chicken
226666,currently in route
72709,where are the winter olympics being taken place
200607,ok google what's the medium well temperature for beef
170615,you should get a text to speech thing on your phone so you can type out and just have it start talking and then and then i can here and not have to refund
170615,whole foods
45046,what's a pathologist
242507,who's timothy simons
182637,historic frostburg
182637,big run
22611,wegmans
286481,is gold bond good for vaginas
212168,open amc plus on roku
230229,rei
230229,i wasn't letting you go
132548,is my phone
131851,where's my phone never mind
30340,where's the remote
252899,what's an onion bargy
54338,can dogs have mixed greens
199574,get the guitar and get your love
101738,tell us a christmas joke
101738,go and play u2 even better than the real thing live
20607,who is the world's strongest man just now
20607,who won the world's strongest man competition
233317,what does the word rustle mean
233317,what does the word resolve mean
233317,what does the food rizzle mean
233317,how do you make brussels
233317,how do you make rissoles
281581,cults swimming pool
77680,what time will the manchester united manchester city cup final kick-off today
288599,in the heat of the
134250,i solemnly swear that i am up to no good
134250,mischief managed
134250,expelliarmus
134250,avada kedavra
134250,crucio
134250,lumos maxima
53965,is apex legends cross platform
187948,interns are really on tv
211196,what do you do i just started
74120,how long is a coon's age
112805,push mix on the spot for weed
65533,who will then you must be the trap
65533,who play barbie dreams
194233,start song over
187463,i said stop
228705,make the volume eight
216821,what to put on a burn for it to stop hurting
31841,how long do you bake chicken for
205518,who was this song
43091,what episode does spongebob rip his pants
182605,is sour cream a sauce
124849,list music
46351,last name denim
107742,the 12-minute one
62099,my face is a little louder please play some music by imagine dragons song
24672,be quiet be quiet now
226167,can cats eat mangoes
273606,how many cups in 64 oz
35545,vikings season
243082,are you warm enough
243082,15
16155,how long until the alarm goes off
235811,dancing monkey
235811,kids dancing monkey
257726,thank you for letting me know google
257726,thank you letting me know google
208817,how many calories is a frozen chicken breasts please
208817,how many calories is 180 g of chicken
208817,how many calories in 180g of chicken breast
208817,how many calories in 100 g of mushrooms
208817,does ice weigh more than water
208817,how many calories in 60 g of red onion
208817,how many calories in red onion
208817,how many calories in a chicken breast
208817,how many calories in 180 g of chicken
208817,how many calories in 180g chicken breast
208817,how many calories in two tablespoons of dark soya sauce
208817,how many calories in dark soy sauce
208817,how many millilitres per tablespoon
208817,66 / 5
208817,290
208817,add this up please
208817,290 + 60 + 25 + 25 + 17 please
208817,115 + 187 + 417
240831,how much is ed sheeran worth
240831,how do you make metal
240831,how do i make metal
240831,74 x 3 please equals
67144,1981 prince of wales and lady diana coin
67144,what's 74 x 2
67144,148 + 140
211338,148 + 101 + 113
115730,225 + 86
115730,311 + 188 + 150
115730,how is it going to fill you up for dinner
229206,egypt
229206,pyramids compared to other buildings
54622,uber
188365,228 + 100 + 2221
188365,stew
188365,228 + 100 + 221 + 154 + 30
188365,how many calories in a boneless thigh fillet chicken
26814,193 / 2 please
26814,100 + 228 + 121 + 89 + 20 + 83 + 96
91195,279 x 5
91195,1395 / 4
91195,how many calories in 200g of chicken breast
91195,how many calories in cherry tomatoes
91195,how many calories in vine tomatoes
91195,140 + 348 + 300 + 50
58274,night at the museum 2
151736,should you pull a tooth out of should you let it come out naturally
48068,pictures of crocodiles
40751,how many calories in 100g of fresh pineapple
40751,how do you spell 100
40751,how many calories in 100 g of pineapple
40751,how many calories in 100g of strawberries
40751,20 + 50 + 43 + 100 =
174251,56 x 2 please
174251,30 + 50 + 43 + 100 + 84 + 121 + 112 + 58 + 60
31313,how many calories in a triple in a double quarter pounder
31313,how many calories in a mcdonald's double quarter pounder
31313,how many calories do you burn per star jump
31313,how many calories in a medium mcdonald's have been in a milk
31313,how many calories in a mcdonald's medium vanilla
44020,what does aubrey marcus station of chia seeds with
44020,what is aubrey marcus same should have chia seeds with
44020,what does aubrey marcus he should have chia seeds with
44020,is chia seed good to have a course
44020,is chia seed good to have with carbs
253969,how long does cooked pasta last for in the fridge
69027,68 x 5
69027,how many calories in 118 g of mushrooms
